1, Unbekannt, Unbekannt, Mueller, Paul, 1948, 10, 11, Bauer, Erika, Mueller, Inga, Mueller, Karl, Mueller, Egon, %, %
2, Mueller, Paul, Mueller, Inga, 1966, 11, 12, Peter, Schmidt, Mueller, Hugo, Mueller, Petra, %, %, %, %
2, Mueller, Paul, Mueller, Karl, 1967, 12, 13, Susanne, Fischer, Mueller, Max, Mueller, Mark, %, %, %, %
3, Mueller, Inga, Schmidt, Hugo, 1988, 9, 14, Schmidt, Tim, Schmidt, Loredana, %, %, %, %, %, %
3, Mueller, Inga, Schmidt, Petra, 1989, 8, 15, Schmidt, Heiko, %, %, %, %, %, %, %, %
3, Mueller, Karl, Mueller, Max, 1990, 7, 16, Mueller, Lisa, %, %, %, %, %, %, %, %
3, Mueller, Karl, Mueller, Mark, 1991, 6, 17, Mueller , Dieter, %, %, %, %, %, %, %, %
